{
  "set_id":             "sites_lostruct_LG28_v1",
  "entity_type":        "variant_site",
  "label":              "LG28 lostruct windows (100-site)",
  "path":               "sets/variant_site/LG28.lostruct.tsv.gz",
  "n_entities":         9871,
  "parent_set_id":      "snps_maf005_v1",
  "derivation_id":      "derive_lostruct_LG28_v1",
  "coordinate_system":  "fClaHyb_Gar_LG_v1",
  "intended_use":       "local PCA inversion scan",
  "status":             "active",
  "created_at":         "2026-04-10T12:00:00Z"
}
